essay_id,essay_set,essay,rater1_domain1,rater2_domain1,rater3_domain1,domain1_score,rater1_mapped_score,rater2_mapped_score
1529,1,"Dear @ORGANIZATION1, I rencently started researching the effects that computers have on people an have found some shocking facts. I do not belive computers benefit society at all. Three reasons why I believe this is because it makes people lack exercising, enjoying nature, and interacting with friends @CAPS1 is a rising problem in @LOCATION1 and a major factor towards @CAPS1 is computers. In fact statics so that people who spend more time exercising than looking at electronics all day actully live longer lives. So my first reason about why computers do not benfit society is that it lets people lack exercise. People need exercise to live and with computers it is becoming more lacking than ever. Also, exercise give you interfines a not more that makes you happy if you live your life exercising instead of watching or doing violant things on the web that will lead to a less violant future. My second reason is that computers cause a lack of enjoying nature. Nature is a beautiful thing filled with simmering lakes, the beautiful scent of balsam fine, and thosands of creatures. With computers thoshands of kids are missing out on the fresh air and adventures that nature has in store. My parents didn't have computers when they were little and they say that they enjoyed running around their neighborhoods playing sports and other fun activities. Finally, computers lack in interacting with friends. Remember when you were little and you called up your friend to hang out and sleepover, well now computers have caused people not to have to call or hang out with friends. Instead you can just @CAPS2 or email them and @CAPS3 you can have a conversation without even looking at a person! In closing, computers cause a lack in exercise, enjoying nature, and interacting with friends. Please help and encourage others to help me put a stop to computers! Thank you for your time and I hope you learned some shocking and interesting facts from this letter. ",4,4,,8,0.6,0.6
646,1,"Today in our society almost everyone uses computers weather @CAPS4 to do research, play games, or interact with others. These are all positive things. The schools across america are using computers from @NUM1 grade to online colledges. People benefit from computers by getting everything and anything done from them. @CAPS2 anyone who has a brain can relize that computers are a positive in todays society. First off computers are a positive thing because they can get almost anything done for you. you can play on them, and interact with others the reason that the computer being able to get almost anything done for you @CAPS4 a good thing because if you need to get work done you can do that if you need research @CAPS1 can do that and @CAPS1 can help you In any subject. The reasons that playing games can be positive @CAPS4 @CAPS1 does not only give you great hand eye cordonation but @CAPS1 also exersises you brain and can be a learning for young children. The reasons that interacting through the computer @CAPS4 that you learn how to be and talk through email for buisnesses and,make many @CAPS2 pleases use your brain and that computer our society today. @CAPS2 to keep on going americans are the smartest people in this world and our very well. I @CAPS3 have to you like and that @CAPS4 why we send every one of them to school @NUM2 of every year. Will that said they use computers anyone to say that computers are bad the that you love do while this. That useing computers and benifiting your life. @CAPS2 as you can see that computers are a thing for the good and can benifit to days saciety @CAPS2 I beg you for your sake please use computers and benifit your life. Its for your own good.",4,5,,9,0.6,0.8
1643,1,"To the @CAPS1 @CAPS2 @CAPS3, This day in age, computer technology rules the world. It's where we get our news, music, shopping and even enterteinment. Sounds great right? But there are some big downsides to this box of information. Such as, this gadget is taking over peoples lives and keeping them from excersizing. Now a days, people are even loosing human interaction from these marvelous toys. And finally, computers are very expensive electronics, they have much up keep which costs you money ultimately making you depressed. As you can see, although there are some great pros to computers, there are also pretty big downfalls that you havn't thought of yet. As I previously stated, computers are taking away from people excersicing. We're all becoming quite lazy. People rather stay at their computer screens playing grand theft auto or facebook stalking than going outside to play a game of soccer with your friends at the empty field down the street. @PERCENT1 of the @LOCATION1 goes without physical domain for at least a @DATE1 and a half. @PERCENT2 of those people rather just tay at home on their computers. This is a disgrace! We cannot let this continue. We must change the way we live and get rid of this unhealthy appliance we call a computer. Of all my reason that computers are bed, this is by far the most disturbing. People are having less, and less human interactions as computers become more popular. Now you, can d everything from your computer. Soon people will be marrying them. Oh wait, that's already happened. Just yesterday, I read in the newest issue of @CAPS4 @CAPS5 that a man married a character in his computer game. There was a priest present and everything. They just recently got back from their honeymoon. This is sad! Look at what our world has become. People rather marry a computer character than actually communicate with real people. We must act quick, I don't know what will happen next. Finally, computer cost a lot of money. You pay @MONEY1 for the computer outright, but then you have all the up keep and there is lots of up keep. Computers are very troublesome. You just keep pouring money into it, which is just depressing. It will just break again soon or freeze and cause you to loose a report you've worked on all night. For example, @DATE1 my dad had to pay @MONEY2 in order to get my @DATE1 computer unbugged. He was so reluctant to even pay it and afterwards he was annoyed all week for even-paying it. It got even worse when it froze up a week later. He was freaking out. Thats all you get from computers, more and more frustration. I just don't think it's worth it.",6,5,,11,1.0,0.8
1452,1,"Dear @PERSON4, I strongly believe that use of computer is beneficial to the community. One reason I feel this way is that computers can improve hand-eye coordination and other skills. These computers provide access to games helpful in @ORGANIZATION2 training. In fact, @ORGANIZATION2, in @LOCATION1, @CAPS1, just began using these games as part of their training this @DATE1. Instructors report that @ORGANIZATION2 skills in trainees and students are far better than in years past. Additionally, computer games can improve reflexes. Two years ago, a man named @PERSON3, @NUM1 years old, fell onto the train tracks just as a train was coming by. Through extra-ordinary reflexes he managed to leap out of the way, saving his life. When asked how he did @CAPS5, he said he had been playing computer games since he was @NUM2 years old. These games also make you more intelligent. The @ORGANIZATION1's @DATE2 study reports that brains were @PERCENT1 more active after use of computers. The researchers achieved this data by attaching electrolytes to the patient's brain both before and after using the computer. @CAPS5 is for these reasons that computers improve hand-eye coordination and other skills. Another reason for why computers are beneficial is that they allow you to talk online. They even allow you to communicate with your family who live far away, strengthening your relationships. I recently got back in touch with my cousin who moved to @LOCATION3. Letters were too expensive and took too long, but email and skype provide us with a great alternative. These computers also improve social skills. @PERSON1, resident here in town, says, ""I love using computers because I can talk to my friends whenever I want, and I feel like @CAPS5 really helps us communicate."" Who wouldn't love a machine that provides a service like that? These computers can even improve your mood. In a test done by @ORGANIZATION3 in @DATE3, @NUM3 people were put in seperate rooms with personal computers for @NUM4 hour. Afterwards, @PERCENT2 said they felt an improvement in their mood. Computers are great because they allow you to talk online. Finally, computers allow you to learn about other places. Virtual tours are becoming more and more common today. Infact, at @CAPS2.org, you can take virtual tours of over @NUM5 different countries, including @LOCATION5, @LOCATION4, @LOCATION2, and @LOCATION6. You can also learn about other cultures and their traditions through online videos at youtube.com and articles at wikipedia.org, the free encyclopedia. You can even learn new recipes. Celebrity chef extraordinare @PERSON2 not only posts all her recipes online at mstewart.com, but she even finds some of them! In a recent interview by @CAPS3 magazine, when asked where she's found some of her best recipes, including her famous @CAPS4 chocolate cake, @PERSON2 admits she found most of them online, saying, ""@CAPS5's a powerful resource that more people should use. Al @CAPS6 currently owns the world's best cookbook!"" @CAPS5 is because of this that computers allow you to learn about other place. Thank you for your time, and I hope you take what I have said into consideration. @CAPS5 is for all of these reasons I strongly believe computers are beneficial to the community.",6,6,,12,1.0,1.0
793,1,"Dear @CAPS1, I believe that computers have a very positive effect on people. Now as technology keeps advancing there are many educational options online, you can now interact with people without physically being with them and you can play games that will enrich your lives. Firstly, I believe that computers offer a wide variety of educational options. On the internet alone you can view your school textbook. You can also have extra practice with the many resources that come with the online textbook. Without physically bringing your textbook home you can view the book online. There are tons of extra practice, and practice quizes in the online textbook that are perfect for studying. Also, when you see on the internet you can get real time updates of major events in the world. For example, the other day I logged onto the internet and saw an article about the earthquake in @LOCATION1. I saw nothing of this in the newspaper, but the internet was so up to date that you can stay informed about something that happened only a few minutes ago. But if you choose not to utilize the internet, there are many programs that are very helpful for learning. That are direclly cetered to developing your children's math and reading skills. These programs can give anyone a jumpstart in education. Another opportunity that could be helpful on a computer is the ability to interact with other people. Video chatting, @CAPS2, and using social @CAPS3 sites are very good ways to interact with people. When you video chat you can have a conversation with some on class on video! Even most they are not physically with you talk to. Instan messaging is a less direct, but still useful who talk to someone far away. You can share the news or just have a conversation with anyone you know. Lastly, social @CAPS3 sites such as facebook, and twitter are a valuable way to communicate with people. You can past messages, play games or simply talk to someone on these websites. They certainly take the best parts of online interaction and put them together. Finally, there are many online games that are very useful. If you ever wanted to go bowling but you never had the time you could play a game online. Or if you have ever wanted to drive a stock car you could play a game online. These online games are good ways to sire you the opportunity to do something you wont normally do. Also many games help sharpen your reflexes and your quick thinking skills. These could possibly cary over into the situations where you need good reflexes and quick thinking. Games could possibly be very useful when you need to prepare yourself something. Also online games are for and enjoying also. Overall I believe the computer is a valuable resource in advertion, interacting with other people and playing useful games. After all who could pass up the opportunity to better prepare yourself for life?",5,6,,11,0.8,1.0
1780,1,"Dear Newspaper I think that computers were one @ORGANIZATION1 the best things ever created. They allow you to talk to people in far away places, help you learn about career and education choises, and you are able to learn about many subjects. Computers are here to help society not hurt it so why shouldn'y we use them? With @CAPS5 we can talk to people around the world or in space @CAPS2 that matter. You might not know it hut all @ORGANIZATION1 the communications in the world need a @CAPS5. There not the kind anyone could go out and but though. There satalites, the orbit the planet from space, @PERSON1, a proffesor at @ORGANIZATION1, told students at @ORGANIZATION3 that, ""A lot @ORGANIZATION1 every day items, such as rars and phones, all use some kind @ORGANIZATION1 @CAPS5."" @CAPS1 computers let people communicate with each other. In addition to letting people communicate they help millions @ORGANIZATION1 people make educational and career choises. Most kids that go to college don't know a lot @ORGANIZATION1 colleges out there. When my sister was picking what college she wanted to go to she didn't know which one to choose. She sat down and looked up hundred @ORGANIZATION1 schools. after narrowing it down she had made her decision she had picked @ORGANIZATION4, a @ORGANIZATION3 she had never even heard @ORGANIZATION1 a couple months ago. People are in this type @ORGANIZATION1 situation all the time at @ORGANIZATION2 a survey was taken by all the students to see what they wanted their career to be, @CAPS2 the rest @ORGANIZATION1 the week students got to experience diffrent carrer options. @PERCENT1 @ORGANIZATION1 the students picked a different carrer after that one week. Have you ever heard the old aget ""@CAPS3 is power""? well its true and computers are a great source @ORGANIZATION1 @CAPS3. they have many different subjects math, science, history language and much much more. people should be using this @CAPS3 at the @CAPS4 francisco national debate @PERSON2. Said that ""@CAPS5 are a great tool when used properly this includes looking up new places math. and even comunicating these are what computers should be used @CAPS2 not unhealthy games. You can learn about many new places with a @CAPS5. In @NUM1 grade my teacher had everyone do areport on a country me and my friend found this place we had both never heard @ORGANIZATION1. with the @CAPS5 we found onts @ORGANIZATION1 information on it such us its main income, exports, resorts, and fun activities. After reading all the facts surely one would agree that a @CAPS5 is a great tool that should be used. It lots people communicate, helps in educational decisions, and you can learn many subjects such as math, science, and language. I strongly believe that all people should use a @CAPS5.",5,4,,9,0.8,0.6
1781,1,"Mom!!! Did you know that the human body has only one liver!!!, @CAPS1 I didn't where did you find out, on the computer. I recently heard that some experts are concerned that people are spending too much time on their computers and less time exercising, and enjoying nature. I dont think that they should be concerned because the computer leave's people with an open mind and teach people new thing. So the computer does a lot for people, give's them the chance to learn new thing, a chance to chat with friends far away, and also expand your mind of travel. Computers can do a lot for a person's life of know'lleage. Just yesterday I found out that the human body can not survive without its liver. The computer also helped me with my strugle's in math, even though that's what the teacher is for she is not always their, like when I am home or away on vacation and I just want to remember so thing's in math. Its also help's people who want to know new launage's such as @CAPS2, @CAPS3, and @CAPS4. So you see a computer has a big affect on a person's life. Two days ago I did a video chat with my grandparents back in @LOCATION2 it was great. After six year's not seeing my grandparents they really changed, and I was starting to forget what they looked like. I never knew that a computer could do a video chat from so far away I was surprised. I dont know why you experts are so concerned about computer taking away people's live's look what it has done for my family. I know that if one of you experts family member went away for a long time you would miss them and want to talk. Some people's love to video chat like people in the army because they get the chance to see their love one's. A two-way ticket to @LOCATION3, To see all those beautiful sight's and taste their wonderful food's look at that waterfall where is that, In @LOCATION4, @LOCATION1 now I have to go their. The computer has shone me places that I have neve sene before. The computer is a wonderful thing. So dont be concerned about us and what we do on the computer. In conclusion dont listen to the experts they dont know what their talking about, for all we know they use the computer more than we do. The compute can touch you new thing, give you the chance to chat with family and friends far away, and open your mind on travel. The computer is not a bad thing all it's doing is making life a little better step by step.",5,5,,10,0.8,0.8
1782,1,"Dear @ORGANIZATION1, I believe that computers are a good source of technology. The reasons which I am fighting for tell why, kids are in school more than half of the school day. Parents should be limiting there childrens use and what they do, and computers are a way of contact and research. To begin, kids are in school more than have of a school day. How could children stay on the computer when there in school learning? They can't. In school you get alot of exercise because your always movign around. After school kids usually do homework or go out with friends. Computers don't have effect on people, if anything it makes them smarter. Secondly, if children have a computer at home their parents should be limiting the time and what exactly they could do on the computer. The people who support advances in technology are correct, computers open up imagination, and learning. Parents of the children that have computers should be more worried than anyone else and if they are , they should just take the computer away. Parents sould also take their kids places more often so the schild win not have to go online. Lastly, computers are a way of contacting others. If you don't have a phone, you use a computer to go on your email, or personal websites. Also poeple need computers for schol work and for their jobs too! Another thing numerous peopel use a computer for is research and reports. We need our information! To conclude, my thoughts are very important to consider because, mny other people would be shy to wirte this and get it published in their local newpaper! I would like to say computers are not interacting with family, friends, nature or anything of that sort. We as a whole need computers to do daily life things, without be able to go online, or save files we would be lost! So I will say again to consider my ideas. Thank you.",4,4,,8,0.6,0.6
1783,1,"Dear @CAPS1, @CAPS2 several reasons on way I that advances in technology are harmful to our socitey is because it opens doors to strangers on the outside world. Its also takes you away from family and friends. Lastly it also takes you away from enjoying life outside of the internet. One of my severl reasons on way I feel advanced technology is harmful to our socitey is because it opens doors to strangers @CAPS2 teens, adult's and etc. The probem with this is that you never really know whos on the other side of that door, that chat room people can miss guide you into thinking there someone who there not. @CAPS2 example theres a show called dateline. This show is about how young teens put there selev's online and grown or young men click on a picture of you and that opens up a chat line or as I say opening a door, you dont know who's on the other side of that door. So these men online makes these teens trust them and make them feel safe if they are a friend you ""hey can I come over sometime?"" you this young teen thinking thats your friend says yea sure. Dont forget you dont see his picture so he come's over and most of three men are looking @CAPS2 a quick fix. If you know what I mean. This is what go's on during dateline t.v show just imarge how many other kids or teens are out there doing the same thing the difference is they dont get caught. Secondly on why is harmful to our socitey is because it takes you away from your family and friends. It takes you away from your kid's family because that will start to fill as if you love that computer more then them. It take you away friends because they might say hey let's go out to the mall or @CAPS2 a drink youll probably say check up on somethings online. This will one move slowly away from you, all over a computer you will start to lose the people most important to you. My last reason on why you can harm society with teconogly is because it takes you away from living your own life and doing thing's you wanna do like online is a bunch of stuff that everybody else say's is cool. Do what you think and feel is cool. @CAPS2 example if someone posted something saying @NUM1 guys lodon is so cool you gotta go there but youve always wanted to go to @LOCATION1, @CAPS3 thing is that you do get to have enough air outside like your skin will get pail and icky and this is why I feel that way. In covlsion all though some people might think that advanced tencogly is good well cleary there not because they open doors to danger, take you away from friends and family. Also it takes you away from what life has to offer.",4,4,,8,0.6,0.6
1750,1,"Dear Local Newspaper, People all around the globe are using computers! Some people think this is a bad idea but I disagree. I believe that computers do have a positive effect on a persons life style. Computers help people stay in touch, computers are only getting better and they help kids in many ways. Computers definitly help people keep in touch. There is @CAPS1, myspace, twitter, facebook, email, and even video chat. For example, my cousin is in @LOCATION1 a sometimes we will go on the computer and talk to on video chat. Without this, we would have no communication with him. Many people around the world use computers to communicate. This is how people use computers to stay in touch. Also, computers are amazing now and they're only going to get better. If computers are so great now, just imagine what they will be like in @NUM1 or @NUM2 years. Plus, the more people buy and use computers the more company are going to want to invent new ones. As you can see computers are only going to get better. The last reason I would like to share with you today is that computers help kids tromendously. On average, about @PERCENT1 of kid in the @CAPS2.S use a computer every day. Kids use it to talk to friends, play games, do homework and to do many other things as well. Also, kids and adults just use computers if they need to know how to do something or even find places in their town. This is how kids are helped out by computers. As you can clearly see, computers are used all around the world for many different reasons. They help to stay in touch, they're only going to improve, and the help kids. Everyone is using computers, shouldn't you?",4,4,,8,0.6,0.6
