essay_id,essay_set,essay,rater1_domain1,rater2_domain1,rater3_domain1,domain1_score,rater1_mapped_score,rater2_mapped_score
1751,1,"Dear local newspaper, I strongly belive that computers don't benefit society as much as people think. I think that nature can provide all of the same qualatys than any computer can. A computure can not provide fitness, real interactions with friends of family, or experience in the real world. Did you know that @PERCENT1 of children in @LOCATION2 are overweight because of a lack of exercising? Acording to @CAPS1 @PERSON1. a @ORGANIZATION2 and @ORGANIZATION1, computer systems are the leading cause of a lack of exercise. So why would a system that leads to obesity be considered a benefit to sociaty? Anotherthing on that topic is that overweight children that spend @NUM1 hours. Put off healthy activatys such as basketball or tennis wich also leaves them socialy behind and lacking he healthy experiences wich leads me to my next point. People think that computers know everything, but the truth is that their are vary little things you can experience on a computer. For example you @MONTH1 read about world war @CAPS2 but you realy know what people were thinking or what the combat fealt like? A computer can not teach you how to feal only a real life experience can do so. Many if you were deployed to an army write in @LOCATION1. You would know what its like to be in war. but playing a game or reading an article don't provide experience. My @NUM2 explamation for how computers are not the greatest affect on scociaty is true life interactions with your family and friends. Their is only one true way to see family or friends and that is personally. People claim that they talk to their friends and family over the @CAPS3 all the time but the only why to be satisfied is by seeing them for real for example a romantic relationship would fail if the only way they communicated was threw the @CAPS3. Unlike most relationships that sucseed. I hope my letter to your newspaper will get peoples attention, I would apretiate it if you joined my cause and help protect scociaty from dangerous computure technology that could cause, obesity, bad relations, and inexperience.",4,4,,8,0.6,0.6
1752,1,"Computers are great technology, but they have a terrible impact on peoples lives! Computers cause children to fail and lose their exercize. The children also put their self in danger by joining a few different websites. Don’t waste your time in a boring computer screen! I am almost @PERCENT1 positive that the students who are doing poorly in school, are the students who go home, throw their back packs in the hallway, and start playing silly games online. My mom use to go on and on about how my dad spents to much time on @CAPS1, when he would only go one @NUM1 minutes a day to talk to family members. Now, my mom created a @CAPS1, that @CAPS2 said @CAPS2 was gona only go on to with the family, but @CAPS2 plays all the pointless applications, such as, ""cafe world."" @CAPS2 waste her time on @CAPS1 whenever @CAPS2 is home, when @CAPS2 could be going out and spending quality time with the family or out with friends. Something I havent mentioned is, I use to be one of those students who come home, throw their stuff in the hallways, and turn on the computer, the only difference is I didnt go online to play games, I would go on to talk to my friends I just saw! I relized after I got my report card that my gades were horifyingly terrible. My dad then disconected my @CAPS4, and I beleive my grades have gone up. At first I hated my dad for disconecting the @CAPS4, but now I want to thank him for breaking a disapointing hoby of being online whenever @CAPS3 home. He also mentioned to my sister how much exersize @CAPS2 was loosing all because @CAPS2 wanted to play online. In alot of ways, computers are pointless! Do you know how dangerous some websites can be? I once watched a television show at my aunts house, and an old creepy guy started a website were the teens had to video tape themselfs choking themselfs and who ever did it the longest won. About a hundred students died from playing the deadly game. There's also a website, ""blogtv.com."" were teens go online and go live on a webcam were anyone can watch them. I remember their was a week when my cousin, denise, and her best friend wanted to see who can get more veiwers. The two girls did unaproprient things on the webshows such as, flashing, dirty dancing, and showing body parts. The two girls were then banned from the website, but this was after people had screen shoted them and posted pictures of the girls. This should not be allowd for anyone to do, it's disterbing! Stop wasting your life people! Go out and have fun, dont let the @CAPS4 keep you home. The @CAPS4 is unsafe and pointless.",4,5,,9,0.6,0.8
1753,1,"To whom it @MONTH1 concern, @CAPS1 many hours a day do you spend on the computer? Too many is my geuss! They are warping the minds of people all over, and in my opinion things should go back to the way they used to be. Some people @MONTH1 disagree, and say that computers help children who are in school. That @MONTH1 be true, but honestly only a couple decades ago the average student didnt even own a computer, and school were teaching the same materials without the usage of them. Also, some children use computers to cheat on homework assignments and essays, and I'm sure many people would agree that that is not helping education for schools. Another reason computers @MONTH1 not benefit society is because of the dangers of them. Sexual predators sworm the internet, and many people talk to strangers over the internet that @MONTH1 be harmful, without even realizing it. A third reason computers @MONTH1 not be help society @CAPS2 you can see, I feel very strongly about the negative effects that computers have on society, for many reason. I hope you can agree with me ",4,4,,8,0.6,0.6
1754,1,"Dear Local Newspaper, @CAPS1 the men and women who write everyday for a living, I would like @CAPS2 you were to write rection on computers. They teach @LOCATION3 faraway places, help build hand-eye coordination, and let @LOCATION3 talk online. Computers are part of everyday life and needs to be told about. First, computer let @LOCATION3 learn about faraway places without leaving the rooms. One of my mom's friends, They decide to move to @LOCATION2 she didn't like computer so didn't look at @LOCATION2's laws saying, I'll find out when I got there. ""@CAPS2 did find out the laws she didn't find enough cause cause she was arrested multiple times in her first few years. A few monthes after her last arrest she came back to the @LOCATION3 where she could deal with the laws. @LOCATION2 is a buetifull country and all of arrests were accidents because she didn't know the laws. Ten minutes on computer searching the laws in @LOCATION2 could have kept her in @LOCATION1. Next, comptures improve hand-eye coordination. From a survey @PERCENT1 of children that spend more time on computers are better at tennis, and at baseball then others. @PERSON3, a gym teacher at the @ORGANIZATION2 says, ""@CAPS3 of these kids that spend time on the compture are weak and need to get some exercise.Dear local newpaper: @CAPS1 you being the local newspaper, you have the power to say how you feel about the effects computers give to people. I believe that computers give great effects to people because it teaches hand-eye coordination, gives people the ability to learn about far away places, and it allows you to talk to people. In all, @PERCENT2 of people agree with my idea about computers. Firstly, using computers teaches people about hand-eye coordination. For example, my grandmother told me that she knows how to use her hands and eyes well because of using the computer. This is because she types and researches information all day long. In all, computers are designed to help your eyes and hands to focus more. Secondly, computers have a lot of interesting information on faraway places. @PERSON2 from @ORGANIZATION1 quotes, ""I always use computers for my work because it helps me learn about many new things. @CAPS5, it lets my wife and I search details about a trip we want to go on."" @CAPS5, the people agree with what @PERSON2 stated. However, people @MONTH1 say that computers give the wrong information many times, but @CAPS2 you find a wonderful website, it will never lie to you. Thirly, @CAPS2 you use computers it will let you talk online or video chat with friends or family all over the world. How this benefits you is because @CAPS2 you have not seen your relatives in ages and you cannot buy a ticket to visit them, then video chat. It has gotten people so much closer and you see the world in a whole different way. @CAPS5, instead of wasting all your cell phone minutes, go buy a laptop or computer with a camera on it so you can video chat. Lastly, taking to people and being active in other peoples life is important. In conclusion, you will have great eye coordination, you will be able to research faraway places, and you will always be allowed to video chat or talk to family online. @CAPS5, I want you to tell the whole world that computers are useful and people use them everyday without a problem. Lastly, you will have the best feeling ever @CAPS2 you make everyone smile by knowing you believe that spending time on the computer can teach you a lot! From so many students having greater hand-eye cooridination they will enjoy what their good at like tennis. @PERSON1, a professor of the human body at @ORGANIZATION1 states ""Technology helps hand-eye. Many who use computers more than others to be greater at @CAPS6 @CAPS7 and games along those lines."" This shows how hand-eye and exercise is linked to computer. Furthermore, computers help @LOCATION3 talk with other people. When a child goes to college they will still be able to email their famlies and talk to them. Talking with others by computers makes the world go round. World business need computers to contact eachother to decuss plans on how to move toward economicly. Lastly, computers are useful and should be useful more. They teach @LOCATION3 of faraway places, improve hand-eye coordnation, and let @LOCATION3 talk to other people. @CAPS2 an article is made to show the pros or computers, more people will experience the wonders of them.",5,5,,10,0.8,0.8
63,1,"Dear local newspaper, I think that computers have a good effect on people. They are good because you can learn things educational. You can hear the latest stories on everything, and you can keep your information down for yourself. Computers are a good thing to have because you can learn information. @CAPS1 you have a question or don't know what something means, you can find out on the internet. These are some internet sources that are @NUM1 to answer questions. @CAPS1 we didnt have computers, then @CAPS1 you have a question, then you would have to go find a book to read in and that takes much more work. Another reason why computers are a good things is because you can catch up on all of the recent stories. You can learn about whats happenings in other parts of the world, you can learn things about celebrities, and you can look at the weather. You can find all this cut on television, but you never knows when it would come on. With computers, you can search all the latest stories and find things cut when you want to know them. With Computers, you can also keep information down. You could use @ORGANIZATION1 and keep everything you need to know in a nice and fashion. You can also make graphs on the computer. This way your graphs will nice have alright time and @CAPS1 you would to go information that in a @CAPS1 there were no computers then your information would not be as and you can it. I believe that computers are a good thing to have because you can hear about the latest stories, and you can keep your own information neat. I believe computers positive effect in people.",4,4,,8,0.6,0.6
64,1,Dear news paper I think computers good for you because you can use the internet and myspace and videos and some school work like math and essays so yes I do think that computers are good for you because you can do all kind of things on computers. And computers can help you with school a lot and you can print out lots of things and why computers can help you is with your math writing spelling and most defyntly is science and ant also literature. The reason why I chose those @NUM1 things is because you can look those @NUM1 things up on. Computer and get the answer to math and spelling right like read @NUM3 helps you write and spell thats one at the reasons why I like computers because I can get on read @NUM3 and I love doing read @NUM3 a lot and I like the read @NUM3 class also because the computers sometimes I like reading on the computers but not all the time but I have to read that's how I'll first learn how to read by forsing my self forward to read. That's how I'll first learned how to read by computers and putting forse to my self. That's why computers is more important to me and look words up.,4,3,,7,0.6,0.4
65,1,"Dear Newspaper, People are spending way too much time on the computer and it is not right. They should be excercising, and interacting with friends and family. Having a computer also distracts them from schoolwork. Computers normally have effects like this on the people that use them. Instead of sitting at the computer all @DATE1 people should be out getting exercise. The @LOCATION1 is one of the coubtries with the most overweight people. Many teenagers are inside all @DATE1 at the computer waiting for their friends screename to pop up so they can talk to them. They don't need to be completely gone, but while they're waiting for their friend they could be exercising. All they need to do is put on some fun music and start dancing around, that will get them the excercise they need for the @DATE1. They also could do ten pushups and twenty curlups, or even more if they wanted to. Instead of sitting at the computer all @DATE1 exercise. Having a computer effects the owner because they don't have a lot of face-to-face converstions with friends and family. You can call your friend up and have them come over your house instead. If they can be at home on the computer for hours then they probably can hang out in real life. Instead of videochatting with your cousins in another state, lan for them to come visit you guys one @DATE1. That way you can actually talk to them and see what they're doing to. You could also play board games, hide and seek, etc. It is much more fun to be with someone in real life, then to talk with them online. The last but deffidently not least effect that computers have on peoples lives is it distracts them from school. Once you start talking with one of your friends, it's pretty hard to stop. Many people don't know how to stop so they don't do the homework they were supposed to do, or they didn't study for the big test the @DATE1, therefore they end up failing it. Some kids will do homework and a on the computer at the same time, the homework is probably wrong because they weren't concentrating on it hard enough. Having a computer effects your life in many different ways, some positive and some negative. Some ways are it ""stops"" you from exercising, it doesn't let you have face-to-face interaction with friends and family and it distracts many kids from school.",5,4,,9,0.8,0.6
66,1,"Wouldnt it be great to use computers in everyday life? In this country we can. You can use it to talk to people you never thought you would see again. Looking at places far away is always an option. You can even simply use it to help with homework essays. Locating and researching, even going to different countries, even different continents is possible to do on the computer. You can buy plan tickets. reserve rooms, even reserve tables at resturants in different countries by just a few clicks. Another thing is, you can research countries, towns, and cities with google instead of having to go out and get books. Reading about and talking to people from different countries is always an option. Being able to talk. and read about people and go to countries just by a clicking a button is pretty amazing. Computers also allow us to talk and communicate to people when there is no other way. The computers give people the ability to talk and see people they they the would never communicate with anymore. An example of this is my father hadn't see his father since he was two, but he started communicating with him and we were able to see him and chat with him through web chat. So these web chatting websites; ooVoo, facebook, myspce, skype, etc, is allowing people to reconnect. This advantage is allowing friendships and relationships to continue, is that really bad? Computers can help people with their homework and essays. For instint, they can type and print their essays instead of having to write it on paper. This helps because first it makes their, it also can be changed quicker and easier. They also can get information about what they are studying quickly and more efficiently. Instead of searching for a word in a big dictionary they can use an online dictionary and just have to type in the word. Online dictionary also have prounociation help and different langages. This helps so much so they can get their work done and exercise, enjoy nature, or interact with family and friends. I hope you will take my opinion seriously and think about it is using computers for daily needs really that bad?",5,4,,9,0.8,0.6
67,1,"Do you think computers effect people's society? Computers help people of age first, computers let you chat with friends and family. Also, computers let you learn a lot about history. Finally, computer is a great way to keep busy. First computer is a great way to chat with friend that you havent spoke to in a long time. Also, it helps you meet new friends and to keep in touch with them in the long run. Finally the computer technologies is outstanding cause it allows you to chat with family memebers across state through video chat or even websites such as myspace, facebook and twitter. Secondly, @ORGANIZATION1 is a great way to learn about history. You can find history on almost everything from the past to the present. You can learn history about famous people places and events. That why I think the computer technologie is so outstanding what you think will happen if we didnt have today? Finally, computer is a great way to keep busy because you take the time looking up information for school projects. Also, you can spent your spare time playing games that help you learn or even book flight ticket for vacation. Finally, the technologie is here for a reason so we should use it for anything like getting up with friends or jus going on to look up information on anything you need to find out. In conclusion, I just told you why computer technologie is good to have. First, it lets you friends and family. Also, computers let you learn a lot about history. Finally, computer is a great way to keep busy. Now I just told you why @ORGANIZATION1 technologie is a good thing to have. I hope agree with my point of view.",4,4,,8,0.6,0.6
1468,1,"Did you know that four out of five households have a computer? But why so many? It's because computers have a positive effect on people, Have you ever thought why? With computers you can contact people in different parts of the @CAPS1. You can search up different information over the internet. Computers also benifit other electronic inventions. What do @LOCATION5, @LOCATION2, @LOCATION6 and @LOCATION7 all have in common? you can contact the people there with computers! while talking to people around the @CAPS1, you can learn something about a culture or lifestyle that you didn't know before. You just might make a new friend along the way. Picture if you will, a hard working business man who lives in the @LOCATION1. He works for a @CAPS1 - famous company and has to go to a meeting with the big boss is @LOCATION4. Wouldn't it just be easier to set up a video chat? That way, there's no hassle with a plane voyage and it's much easier. Why do you think it's called the @CAPS1-@CAPS2 @CAPS3? Over the internet, you can search up unlimited amounts of information. Animals, sports, a report to do on @LOCATION3, where do you go to find easy-to-read information instantly? Search him up on @ORGANIZATION1 or @ORGANIZATION2. You never what might find out. There are new additions daily. With no computers, how would you download music to an @NUM1? You can't, you have to use a computer. Computers benifit a lot of other electronic equipment. You can download videos, print out photographs and charge @CAPS4 and other electronics. Technology these days is empressive. It gave birth to the much-used computer. Computers have a large positive effect on our lifestyle. Contact with otehrs around the @CAPS1 is now easier than ever. Information can be found instantly. And with computers, other electronics can work as well.",4,5,,9,0.6,0.8
1469,1,"Dear @LOCATION1, @CAPS1 you believe people spend way to much that on computers? In a survey @PERCENT1 out of @NUM1 of people rather go on the computer then take a walk in as parts. People who spend a lot of time on computers are lacking important things. For istance, they spend so much time on computer they have lose time to exerise, enjoy natue, and interact with friends and family. Computers have a negative effect on people. Many people don't excerise for only @NUM2 min. But when you are distracted on your computer aming or facebooking you forget to excrise or just go it for @NUM3 min. Because you want to get back to the computer. Computers on your desk starring at you and you sampled to go on. While, the yoga mat or weights sit on ground sterring at you too. However, the computers is mak fun and less woris. Therefore, your more willing to go on computer then excrise. Computers make it hand to excrise because your less into thinking how to this right and take you the because your thinking about a computer game, you played facebook, email and bunch more things on computer. So computers are unhealthy for people to have. Nature is beatiful, how the trees sway in the and butterflies fly in the air then there are all type of seasons with beatiful senery and. However there re stuffy room with sholves a desk and some picture that's the serey the people got when @MONTH1 are on the computer all the time. People are missing out on enjoying nature little and big beatities. People comuter aren't walking on beach on taking a nice long hike in woods dad not taking a stroll in a ark these are missing out on getting some fresh air and seeing the senery nature has to offer us. Instead they are sitting chair starring at a computer screen. However, pretty could that be compared to enjoying nature beatity? Computers are testing away people enjoying nature. Hanging-out with friends are family is a fun thing to @CAPS1 but how are you suppose to long out with them if your to the computer? They aren't going to internet with their friends or family. This could affect their future they could grow up sad and lonely aren't know how to act around people they get job their works around people. The people who are addicted to computer are missing out an doing something fun with some they lose or enjoy to be around. Computers could be people far away friends but how about instead call that friend on. They probably rather hear wire then. See a message so computers interesting with friends and family. Now, that you know how had the computers affect people you can understand why I'm computers. They cut in the peoples the excrise, and have people not enjoying nature. people want hang out with friends and famlies. So hopefully you can see what a bad affect computers have.",4,4,,8,0.6,0.6
